<?xml version="1.0" encoding="UTF-8" standalone="yes"?>
<entity xmlns="http://orionsoft.net.br/entityMetadata" xmlns:xsi="http://www.w3.org/2001/XMLSchema-instance" description="Permite configura cadastrar uma conta de e-mail que poderá ser usada nos serviços de envio de e-mail" hint="" label="Conta de e-mail" name="EmailAccount" propertiesInQueryGrid="id useAsDefault host user senderName senderMail" crudOperations="CREATE RETRIEVE UPDATE DELETE QUERY" className="br.com.orionsoft.monstrengo.mail.entities.EmailAccount" xsi:schemaLocation="http://orionsoft.net.br/entityMetadata http://orionsoft.net.br/entityMetadata.xsd">
    <group description="" hint="" label="Dados da conta" name="Geral">
        <property xsi:type="PropertyNumericType" description="" hint="" label="Id" name="id"/>
        <property xsi:type="PropertyStringType" description="mail.servername.com.br:portNumber" hint="Define o endereço do servidor SMTP que será utilizado para enviar os e-mails" label="Host" name="host"/>
        <property xsi:type="PropertyStringType" description="Preencha este campo apenas se a conexão com o servidor exigir autenticação." hint="Define o usuário que será utilizado para a autenticação no servidor" label="Nome do usuário" name="user"/>
        <property xsi:type="PropertyStringType" description="Preencha este campo apenas se a conexão com o servidor exigir autenticação." hint="Define a senha que será utilizado para autenticação no servidor" label="Senha do usuário" name="password"/>
        <property xsi:type="PropertyStringType" description="Define o nome do remetente que aparecerá nos e-mails enviados por esta conta" hint="Define o nome do remetente para esta conta" label="Nome do remetente" name="senderName"/>
        <property xsi:type="PropertyStringType" description="Define o e-mail do remetente que aparecerá nos e-mails enviados por esta conta" hint="Define o e-mail do remetente para esta conta" label="e-mail do remetente" name="senderMail"/>
    </group>
    <group description="" hint="" label="Configuração" name="Configuração">
        <property xsi:type="PropertyStringType" description="Ex.: mail.smtp.starttls.enable=true;mail.smtp.auth=true;" hint="Permite definir configurações adicionais exigidas por alguns serviços SMTP" label="Configurações adicionais" name="properties"/>
        <property xsi:type="PropertyBooleanType" description="Marcando esta propriedade, você definirá esta conta como a padrão para envio de e-mail. Outra conta padrão marcada será automaticamente desmarcada. A conta padrão é utilizada pelo serviço de envio de e-Mail quando nenhuma conta é especificada." hint="Define esta conta de e-mail como a conta padrão" label="Usar esta conta como padrão" name="useAsDefault"/>
    </group>
</entity>
