<?xml version="1.0" encoding="UTF-8" standalone="yes"?>
<entity xmlns="http://orionsoft.net.br/entityMetadata" xmlns:xsi="http://www.w3.org/2001/XMLSchema-instance" description="" hint="" label="Tabela IRRF - Alíquota" name="IRRFAliquota" runQueryOnOpen="true" propertiesInQueryGrid="id valorInicial valorFinal aliquota valorDeducao tabela" crudOperations="CREATE RETRIEVE UPDATE DELETE QUERY" className="br.com.orionsoft.financeiro.gerenciador.entities.IRRFAliquota" xsi:schemaLocation="http://orionsoft.net.br/entityMetadata http://orionsoft.net.br/entityMetadata.xsd">
    <group description="" hint="" label="Geral" name="Geral">
        <property xsi:type="PropertyNumericType" description="" hint="" label="Id" name="id"/>
        <property xsi:type="PropertyNumericType" description="" hint="" label="Valor inicial" name="valorInicial" />
        <property xsi:type="PropertyNumericType" description="" hint="" label="Valor final" name="valorFinal"/>
        <property xsi:type="PropertyNumericType" description="" hint="" label="Alíquota" name="aliquota"/>
        <property xsi:type="PropertyNumericType" description="" hint="" label="Valor da dedução" name="valorDeducao"/>
        <property xsi:type="PropertyEntityType" description="" hint="" label="Tabela" name="tabela" readOnly="true"/>
    </group>
</entity>
